<?xml version="1.0" encoding="UTF-8"?>
<xs:schema xmlns:xs="http://www.w3.org/2001/XMLSchema">
    <xs:element name="aptech">
        <xs:complexType>
            <xs:sequence>
                <xs:element name="faculty" minOccurs="1" maxOccurs="unbounded">
                    <xs:complexType>
                        <xs:sequence>
                            <xs:element name="name" type="xs:string" />
                            <xs:element name="designation" type="xs:string"/>
                            <xs:element name="salary" type="xs:integer"/>
                        </xs:sequence>
                    </xs:complexType>
                </xs:element>
                <xs:element name="it" minOccurs="1" maxOccurs="unbounded">
                    <xs:complexType>
                        <xs:sequence>
                            <xs:element name="name" type="xs:string"/>
                            <xs:element name="age" type="xs:integer"/>
                            <xs:element name="email" type="xs:string"/>
                            <xs:element name="password" type="xs:string"/>
                        </xs:sequence>
                    </xs:complexType>

                </xs:element>
            </xs:sequence>
        </xs:complexType>
        
    </xs:element>
</xs:schema>